{"schema_id":"completion-package","schema_version":"1.0.0","q_id":"Q-DEMO-001","execution_id":"exec-001","attempt_id":"attempt-001","correlation_id":"corr-001","startup_report":{"verdict":"GO"},"completion_report":{"verdict":"PASS"},"changed_files":["docs/contracts/demo.md"],"validation_evidence":[{"check":"git diff --check","status":"PASS"}],"safe_commit_set":["docs/contracts/demo.md"],"suggested_commit_message":"docs: add demo","repository_state":{"branch":"main","dirty":true},"expected_head_at_review":"1111111111111111111111111111111111111111","actual_head":"1111111111111111111111111111111111111111","diff_digest":"sha256:cccccccccccccccccccccccccccccccccccccccccccccccccccccccccccccccc","follow_up_candidates":[],"scw_warnings":[],"produced_artifacts":["artifact-completion-001"],"completion_status":"PASS"}
